{
  "$schema": "../profile.schema.json",
  "id": "urs:profile:xx/1",
  "region": "XX",
  "label": "Region-neutral (US, UK, CA, NZ and most of Western Europe)",
  "pages": 2,
  "sections": [
    "summary",
    "skills",
    "experience",
    "education",
    "credentials"
  ],
  "work_rights": false
}
