{
  "$schema": "../profile.schema.json",
  "id": "urs:profile:ae/1",
  "region": "AE",
  "label": "United Arab Emirates (and broadly the GCC)",
  "pages": 3,
  "sections": [
    "summary",
    "skills",
    "experience",
    "education",
    "credentials",
    "languages"
  ],
  "declaration": false,
  "work_rights": true
}
